date,title,slug,category,keyword
2027-06-16,"uBlock Origin for LinkedIn June 2027",ublock-origin-for-linkedin-june-2027,comparison,"uBlock Origin for LinkedIn"
2027-06-17,"Stop LinkedIn Distractions June 2027",stop-linkedin-distractions-june-2027,strategy,"stop LinkedIn distractions"
2027-06-18,"Best LinkedIn Ad Blocker June 2027",best-linkedin-ad-blocker-june-2027,ads,"best LinkedIn ad blocker"
2027-06-19,"Why LinkedIn Shows Loves This on Chrome",why-linkedin-shows-loves-this-on-chrome,reactions,"why LinkedIn shows loves this posts"
2027-06-20,"Why LinkedIn Shows Reposts June 2027",why-linkedin-shows-reposts-june-2027,shares,"why LinkedIn shows reposts"
2027-06-21,"Why LinkedIn Recommends Posts June 2027",why-linkedin-recommends-posts-june-2027,suggested,"why LinkedIn recommends posts"
2027-06-22,"LinkedIn Feed for Marketers June 2027",linkedin-feed-for-marketers-june-2027,persona,"LinkedIn feed for marketers"
2027-06-23,"AdBlock on LinkedIn Feed June 2027",adblock-on-linkedin-feed-june-2027,comparison,"AdBlock for LinkedIn"
2027-06-24,"What a LinkedIn Feed Cleaner Does June 2027",what-a-linkedin-feed-cleaner-does-june-2027,strategy,"LinkedIn feed cleaner"
2027-06-25,"Block Promoted Posts on LinkedIn Ad Guide",block-promoted-posts-on-linkedin-ad-guide,ads,"block promoted posts LinkedIn"
2027-06-26,"Hide Celebrates This on LinkedIn: Setup",hide-celebrates-this-on-linkedin-setup,reactions,"hide celebrates this on LinkedIn"
2027-06-27,"Why LinkedIn Shows Shared Posts June 2027",why-linkedin-shows-shared-posts-june-2027,shares,"why LinkedIn shows shared posts"
2027-06-28,"Hide LinkedIn Recommended Content on Chrome",hide-linkedin-recommended-content-on-chrome,suggested,"hide recommended content on LinkedIn"
2027-06-29,"LinkedIn Feed for Founders June 2027",linkedin-feed-for-founders-june-2027,persona,"LinkedIn feed for founders"
2027-06-30,"LinkedIn Settings vs Feed Cleaner on Chrome",linkedin-settings-vs-feed-cleaner-on-chrome,comparison,"native LinkedIn settings vs feed cleaner"
2027-07-01,"LinkedIn Chrome Extension Guide July 2027",linkedin-chrome-extension-guide-july-2027,strategy,"LinkedIn chrome extension"
2027-07-02,"How to Remove LinkedIn Ads July 2027",how-to-remove-linkedin-ads-july-2027,ads,"remove LinkedIn ads"
2027-07-03,"Hide Insightful Posts on LinkedIn: Setup",hide-insightful-posts-on-linkedin-setup,reactions,"hide insightful posts on LinkedIn"
2027-07-04,"Hide Shared Posts on LinkedIn Quick Fix",hide-shared-posts-on-linkedin-quick-fix,shares,"hide shared posts on LinkedIn"
2027-07-05,"Hide Suggested Posts on LinkedIn on Chrome",hide-suggested-posts-on-linkedin-on-chrome,suggested,"hide suggested posts on LinkedIn"
2027-07-06,"LinkedIn Feed for Consultants: Playbook",linkedin-feed-for-consultants-playbook,persona,"LinkedIn feed for consultants"
2027-07-07,"LinkTopics vs LinkedIn Premium on Chrome",linktopics-vs-linkedin-premium-on-chrome,comparison,"LinkTopics vs LinkedIn Premium"
2027-07-08,"Clean LinkedIn Feed for Focus July 2027",clean-linkedin-feed-for-focus-july-2027,strategy,"clean LinkedIn feed"
2027-07-09,"How to Hide Promoted Posts on LinkedIn on Chrome",how-to-hide-promoted-posts-on-linkedin-on-chrome,ads,"hide promoted posts on LinkedIn"
2027-07-10,"Hide Supports This on LinkedIn at Work",hide-supports-this-on-linkedin-at-work,reactions,"hide supports this on LinkedIn"
2027-07-11,"Hide Reshared Posts on LinkedIn Quick Fix",hide-reshared-posts-on-linkedin-quick-fix,shares,"hide reshared posts on LinkedIn"
2027-07-12,"Hide Recommended Posts on LinkedIn Quick Fix",hide-recommended-posts-on-linkedin-quick-fix,suggested,"hide recommended posts on LinkedIn"
2027-07-13,"LinkedIn Feed for Job Seekers: Playbook",linkedin-feed-for-job-seekers-playbook,persona,"LinkedIn feed for job seekers"
2027-07-14,"LinkTopics vs LinkedIn Ad Blockers July 2027",linktopics-vs-linkedin-ad-blockers-july-2027,comparison,"LinkTopics vs LinkedIn ad blockers"
2027-07-15,"LinkedIn Feed for Productivity July 2027",linkedin-feed-for-productivity-july-2027,strategy,"LinkedIn feed productivity"
2027-07-16,"Hide Sponsored Posts on LinkedIn on Chrome",hide-sponsored-posts-on-linkedin-on-chrome,ads,"hide sponsored posts on LinkedIn"
2027-07-17,"Hide Likes This Posts on LinkedIn: Setup",hide-likes-this-posts-on-linkedin-setup,reactions,"how to hide likes this posts on LinkedIn"
2027-07-18,"Hide Reposted Posts on LinkedIn Quick Fix",hide-reposted-posts-on-linkedin-quick-fix,shares,"hide reposted posts on LinkedIn"
2027-07-19,"Why LinkedIn Suggests Posts July 2027",why-linkedin-suggests-posts-july-2027,suggested,"why LinkedIn suggests posts"
2027-07-20,"LinkedIn Feed for HR Teams July 2027",linkedin-feed-for-hr-teams-july-2027,persona,"LinkedIn feed for HR teams"
2027-07-21,"Feed Cleaner vs Manual Cleanup July 2027",feed-cleaner-vs-manual-cleanup-july-2027,comparison,"feed cleaner vs manual cleanup"
2027-07-22,"LinkedIn Focus Mode Guide July 2027",linkedin-focus-mode-guide-july-2027,strategy,"LinkedIn focus mode"
2027-07-23,"Best LinkedIn Ad Blocker July 2027",best-linkedin-ad-blocker-july-2027,ads,"best LinkedIn ad blocker"
2027-07-24,"Hide Liked Posts on LinkedIn on Chrome",hide-liked-posts-on-linkedin-on-chrome,reactions,"hide liked posts on LinkedIn"
2027-07-25,"Why LinkedIn Shows Reposts July 2027",why-linkedin-shows-reposts-july-2027,shares,"why LinkedIn shows reposts"
2027-07-26,"Why LinkedIn Recommends Posts July 2027",why-linkedin-recommends-posts-july-2027,suggested,"why LinkedIn recommends posts"
2027-07-27,"LinkedIn Feed for Recruiters July 2027",linkedin-feed-for-recruiters-july-2027,persona,"LinkedIn feed for recruiters"
2027-07-28,"uBlock Origin for LinkedIn July 2027",ublock-origin-for-linkedin-july-2027,comparison,"uBlock Origin for LinkedIn"
2027-07-29,"Stop LinkedIn Distractions July 2027",stop-linkedin-distractions-july-2027,strategy,"stop LinkedIn distractions"
2027-07-30,"Block Promoted Posts on LinkedIn on Chrome",block-promoted-posts-on-linkedin-on-chrome,ads,"block promoted posts LinkedIn"
2027-07-31,"Hide Reacted Posts on LinkedIn for Work",hide-reacted-posts-on-linkedin-for-work,reactions,"hide reacted posts on LinkedIn"
2027-08-01,"Why LinkedIn Shows Shared Posts: Explained",why-linkedin-shows-shared-posts-explained,shares,"why LinkedIn shows shared posts"
2027-08-02,"Hide LinkedIn Recommended Content Quick Fix",hide-linkedin-recommended-content-quick-fix,suggested,"hide recommended content on LinkedIn"
2027-08-03,"LinkedIn Feed for Sales Teams: Checklist",linkedin-feed-for-sales-teams-checklist,persona,"LinkedIn feed for sales teams"
2027-08-04,"AdBlock on LinkedIn Feed August 2027",adblock-on-linkedin-feed-august-2027,comparison,"AdBlock for LinkedIn"
2027-08-05,"What a LinkedIn Feed Cleaner Does: Explained",what-a-linkedin-feed-cleaner-does-explained,strategy,"LinkedIn feed cleaner"
2027-08-06,"How to Remove LinkedIn Ads Quick Tips",how-to-remove-linkedin-ads-quick-tips,ads,"remove LinkedIn ads"
2027-08-07,"Why LinkedIn Shows Loves This Quick Fix",why-linkedin-shows-loves-this-quick-fix,reactions,"why LinkedIn shows loves this posts"
2027-08-08,"Hide Shared Posts on LinkedIn: Explained",hide-shared-posts-on-linkedin-explained,shares,"hide shared posts on LinkedIn"
2027-08-09,"Hide Suggested Posts on LinkedIn Quick Fix",hide-suggested-posts-on-linkedin-quick-fix,suggested,"hide suggested posts on LinkedIn"
2027-08-10,"LinkedIn Feed for Marketers: Checklist",linkedin-feed-for-marketers-checklist,persona,"LinkedIn feed for marketers"
2027-08-11,"LinkedIn Settings vs Feed Cleaner: Explained",linkedin-settings-vs-feed-cleaner-explained,comparison,"native LinkedIn settings vs feed cleaner"
2027-08-12,"LinkedIn Chrome Extension Guide: Explained",linkedin-chrome-extension-guide-explained,strategy,"LinkedIn chrome extension"
2027-08-13,"How to Hide Promoted Posts on LinkedIn Quick Fix",how-to-hide-promoted-posts-on-linkedin-quick-fix,ads,"hide promoted posts on LinkedIn"
2027-08-14,"Hide Celebrates This on LinkedIn at Work",hide-celebrates-this-on-linkedin-at-work,reactions,"hide celebrates this on LinkedIn"
2027-08-15,"Hide Reshared Posts on LinkedIn: Explained",hide-reshared-posts-on-linkedin-explained,shares,"hide reshared posts on LinkedIn"
2027-08-16,"Hide Recommended Posts on LinkedIn: Explained",hide-recommended-posts-on-linkedin-explained,suggested,"hide recommended posts on LinkedIn"
2027-08-17,"LinkedIn Feed for Founders: Daily Tips",linkedin-feed-for-founders-daily-tips,persona,"LinkedIn feed for founders"
2027-08-18,"LinkTopics vs LinkedIn Premium: Explained",linktopics-vs-linkedin-premium-explained,comparison,"LinkTopics vs LinkedIn Premium"
2027-08-19,"Clean LinkedIn Feed for Focus: Checklist",clean-linkedin-feed-for-focus-checklist,strategy,"clean LinkedIn feed"
2027-08-20,"Hide Sponsored Posts on LinkedIn Quick Fix",hide-sponsored-posts-on-linkedin-quick-fix,ads,"hide sponsored posts on LinkedIn"
2027-08-21,"Hide Insightful Posts on LinkedIn at Work",hide-insightful-posts-on-linkedin-at-work,reactions,"hide insightful posts on LinkedIn"
2027-08-22,"Hide Reposted Posts on LinkedIn: Explained",hide-reposted-posts-on-linkedin-explained,shares,"hide reposted posts on LinkedIn"
2027-08-23,"Why LinkedIn Suggests Posts Now",why-linkedin-suggests-posts-now,suggested,"why LinkedIn suggests posts"
2027-08-24,"LinkedIn Feed for Consultants: Checklist",linkedin-feed-for-consultants-checklist,persona,"LinkedIn feed for consultants"
2027-08-25,"LinkTopics vs LinkedIn Ad Blockers: Explained",linktopics-vs-linkedin-ad-blockers-explained,comparison,"LinkTopics vs LinkedIn ad blockers"
2027-08-26,"LinkedIn Feed for Productivity: Explained",linkedin-feed-for-productivity-explained,strategy,"LinkedIn feed productivity"
2027-08-27,"Best LinkedIn Ad Blocker August 2027",best-linkedin-ad-blocker-august-2027,ads,"best LinkedIn ad blocker"
2027-08-28,"Hide Supports This on LinkedIn for Work",hide-supports-this-on-linkedin-for-work,reactions,"hide supports this on LinkedIn"
2027-08-29,"Why LinkedIn Shows Reposts August 2027",why-linkedin-shows-reposts-august-2027,shares,"why LinkedIn shows reposts"
2027-08-30,"Why LinkedIn Recommends Posts",why-linkedin-recommends-posts,suggested,"why LinkedIn recommends posts"
2027-08-31,"LinkedIn Feed for Job Seekers: Checklist",linkedin-feed-for-job-seekers-checklist,persona,"LinkedIn feed for job seekers"
2027-09-01,"Feed Cleaner vs Manual Cleanup: Explained",feed-cleaner-vs-manual-cleanup-explained,comparison,"feed cleaner vs manual cleanup"
2027-09-02,"LinkedIn Focus Mode Guide: Quick Guide",linkedin-focus-mode-guide-quick-guide,strategy,"LinkedIn focus mode"
2027-09-03,"Block Promoted Posts on LinkedIn Quick Fix",block-promoted-posts-on-linkedin-quick-fix,ads,"block promoted posts LinkedIn"
2027-09-04,"Hide Likes This Posts on LinkedIn at Work",hide-likes-this-posts-on-linkedin-at-work,reactions,"how to hide likes this posts on LinkedIn"
2027-09-05,"Why LinkedIn Shows Shared Posts: Quick Guide",why-linkedin-shows-shared-posts-quick-guide,shares,"why LinkedIn shows shared posts"
2027-09-06,"Hide LinkedIn Recommended Content: Explained",hide-linkedin-recommended-content-explained,suggested,"hide recommended content on LinkedIn"
2027-09-07,"LinkedIn Feed for HR Teams: Daily Tips",linkedin-feed-for-hr-teams-daily-tips,persona,"LinkedIn feed for HR teams"
2027-09-08,"uBlock Origin for LinkedIn Today",ublock-origin-for-linkedin-today,comparison,"uBlock Origin for LinkedIn"
2027-09-09,"Stop LinkedIn Distractions Today",stop-linkedin-distractions-today,strategy,"stop LinkedIn distractions"
2027-09-10,"How to Remove LinkedIn Ads Work Guide",how-to-remove-linkedin-ads-work-guide,ads,"remove LinkedIn ads"
2027-09-11,"Hide Liked Posts on LinkedIn Quick Fix",hide-liked-posts-on-linkedin-quick-fix,reactions,"hide liked posts on LinkedIn"
2027-09-12,"Hide Shared Posts on LinkedIn",hide-shared-posts-on-linkedin,shares,"hide shared posts on LinkedIn"
2027-09-13,"Hide Suggested Posts on LinkedIn: Explained",hide-suggested-posts-on-linkedin-explained,suggested,"hide suggested posts on LinkedIn"
2027-09-14,"LinkedIn Feed for Recruiters: Checklist",linkedin-feed-for-recruiters-checklist,persona,"LinkedIn feed for recruiters"
2027-09-15,"AdBlock on LinkedIn Feed: Side by Side",adblock-on-linkedin-feed-side-by-side,comparison,"AdBlock for LinkedIn"
2027-09-16,"What a LinkedIn Feed Cleaner Does: Checklist",what-a-linkedin-feed-cleaner-does-checklist,strategy,"LinkedIn feed cleaner"
2027-09-17,"How to Hide Promoted Posts on LinkedIn Work Tips",how-to-hide-promoted-posts-on-linkedin-work-tips,ads,"hide promoted posts on LinkedIn"
2027-09-18,"Hide Reacted Posts on LinkedIn",hide-reacted-posts-on-linkedin,reactions,"hide reacted posts on LinkedIn"
2027-09-19,"Hide Reshared Posts on LinkedIn: Quick Guide",hide-reshared-posts-on-linkedin-quick-guide,shares,"hide reshared posts on LinkedIn"
2027-09-20,"Hide Recommended Posts on LinkedIn: Quick Guide",hide-recommended-posts-on-linkedin-quick-guide,suggested,"hide recommended posts on LinkedIn"
2027-09-21,"LinkedIn Feed for Sales Teams",linkedin-feed-for-sales-teams,persona,"LinkedIn feed for sales teams"
2027-09-22,"LinkedIn Settings vs Feed Cleaner: Checklist",linkedin-settings-vs-feed-cleaner-checklist,comparison,"native LinkedIn settings vs feed cleaner"
2027-09-23,"LinkedIn Chrome Extension Guide: Checklist",linkedin-chrome-extension-guide-checklist,strategy,"LinkedIn chrome extension"
2027-09-24,"Hide Sponsored Posts on LinkedIn Work Tips",hide-sponsored-posts-on-linkedin-work-tips,ads,"hide sponsored posts on LinkedIn"
2027-09-25,"Why LinkedIn Shows Loves This: Explained",why-linkedin-shows-loves-this-explained,reactions,"why LinkedIn shows loves this posts"
2027-09-26,"Hide Reposted Posts on LinkedIn: Quick Guide",hide-reposted-posts-on-linkedin-quick-guide,shares,"hide reposted posts on LinkedIn"
2027-09-27,"Why LinkedIn Suggests Posts: Quick Guide",why-linkedin-suggests-posts-quick-guide,suggested,"why LinkedIn suggests posts"
2027-09-28,"LinkedIn Feed for Marketers: Daily Tips",linkedin-feed-for-marketers-daily-tips,persona,"LinkedIn feed for marketers"
2027-09-29,"LinkTopics vs LinkedIn Premium: Checklist",linktopics-vs-linkedin-premium-checklist,comparison,"LinkTopics vs LinkedIn Premium"
2027-09-30,"Clean LinkedIn Feed for Focus",clean-linkedin-feed-for-focus,strategy,"clean LinkedIn feed"
2027-10-01,"Best LinkedIn Ad Blocker: Quick Guide",best-linkedin-ad-blocker-quick-guide,ads,"best LinkedIn ad blocker"
2027-10-02,"Hide Celebrates This on LinkedIn for Work",hide-celebrates-this-on-linkedin-for-work,reactions,"hide celebrates this on LinkedIn"
2027-10-03,"Why LinkedIn Shows Reposts: Quick Guide",why-linkedin-shows-reposts-quick-guide,shares,"why LinkedIn shows reposts"
2027-10-04,"Why LinkedIn Recommends Posts: Quick Guide",why-linkedin-recommends-posts-quick-guide,suggested,"why LinkedIn recommends posts"
2027-10-05,"LinkedIn Feed for Founders Today",linkedin-feed-for-founders-today,persona,"LinkedIn feed for founders"
2027-10-06,"LinkTopics vs LinkedIn Ad Blockers: Checklist",linktopics-vs-linkedin-ad-blockers-checklist,comparison,"LinkTopics vs LinkedIn ad blockers"
2027-10-07,"LinkedIn Feed for Productivity: Checklist",linkedin-feed-for-productivity-checklist,strategy,"LinkedIn feed productivity"
2027-10-08,"Block Promoted Posts on LinkedIn Work Tips",block-promoted-posts-on-linkedin-work-tips,ads,"block promoted posts LinkedIn"
2027-10-09,"Hide Insightful Posts on LinkedIn for Work",hide-insightful-posts-on-linkedin-for-work,reactions,"hide insightful posts on LinkedIn"
2027-10-10,"Why LinkedIn Shows Shared Posts October 2027",why-linkedin-shows-shared-posts-october-2027,shares,"why LinkedIn shows shared posts"
2027-10-11,"Hide LinkedIn Recommended Content: Quick Guide",hide-linkedin-recommended-content-quick-guide,suggested,"hide recommended content on LinkedIn"
2027-10-12,"LinkedIn Feed for Consultants",linkedin-feed-for-consultants,persona,"LinkedIn feed for consultants"
2027-10-13,"Feed Cleaner vs Manual Cleanup: Checklist",feed-cleaner-vs-manual-cleanup-checklist,comparison,"feed cleaner vs manual cleanup"
2027-10-14,"LinkedIn Focus Mode Guide: Focus Guide",linkedin-focus-mode-guide-focus-guide,strategy,"LinkedIn focus mode"
2027-10-15,"How to Remove LinkedIn Ads Today",how-to-remove-linkedin-ads-today,ads,"remove LinkedIn ads"
2027-10-16,"Hide Supports This on LinkedIn",hide-supports-this-on-linkedin,reactions,"hide supports this on LinkedIn"
2027-10-17,"Hide Shared Posts on LinkedIn: Quick Guide",hide-shared-posts-on-linkedin-quick-guide,shares,"hide shared posts on LinkedIn"
2027-10-18,"Hide Suggested Posts on LinkedIn: Quick Guide",hide-suggested-posts-on-linkedin-quick-guide,suggested,"hide suggested posts on LinkedIn"
2027-10-19,"LinkedIn Feed for Job Seekers",linkedin-feed-for-job-seekers,persona,"LinkedIn feed for job seekers"
2027-10-20,"uBlock Origin for LinkedIn 2027",ublock-origin-for-linkedin-2027,comparison,"uBlock Origin for LinkedIn"
2027-10-21,"Stop LinkedIn Distractions 2027",stop-linkedin-distractions-2027,strategy,"stop LinkedIn distractions"
2027-10-22,"How to Hide Promoted Posts on LinkedIn Feed Tips",how-to-hide-promoted-posts-on-linkedin-feed-tips,ads,"hide promoted posts on LinkedIn"
2027-10-23,"Hide Likes This Posts on LinkedIn for Work",hide-likes-this-posts-on-linkedin-for-work,reactions,"how to hide likes this posts on LinkedIn"
2027-10-24,"Hide Reshared Posts on LinkedIn October 2027",hide-reshared-posts-on-linkedin-october-2027,shares,"hide reshared posts on LinkedIn"
2027-10-25,"Hide Recommended Posts on LinkedIn October 2027",hide-recommended-posts-on-linkedin-october-2027,suggested,"hide recommended posts on LinkedIn"
2027-10-26,"LinkedIn Feed for HR Teams Today",linkedin-feed-for-hr-teams-today,persona,"LinkedIn feed for HR teams"
2027-10-27,"AdBlock on LinkedIn Feed October 2027",adblock-on-linkedin-feed-october-2027,comparison,"AdBlock for LinkedIn"
2027-10-28,"What a LinkedIn Feed Cleaner Does: Daily Tips",what-a-linkedin-feed-cleaner-does-daily-tips,strategy,"LinkedIn feed cleaner"
2027-10-29,"Hide Sponsored Posts on LinkedIn Feed Tips",hide-sponsored-posts-on-linkedin-feed-tips,ads,"hide sponsored posts on LinkedIn"
2027-10-30,"Hide Liked Posts on LinkedIn: Explained",hide-liked-posts-on-linkedin-explained,reactions,"hide liked posts on LinkedIn"
2027-10-31,"Hide Reposted Posts on LinkedIn October 2027",hide-reposted-posts-on-linkedin-october-2027,shares,"hide reposted posts on LinkedIn"
2027-11-01,"Why LinkedIn Suggests Posts",why-linkedin-suggests-posts,suggested,"why LinkedIn suggests posts"
2027-11-02,"LinkedIn Feed for Recruiters: Daily Tips",linkedin-feed-for-recruiters-daily-tips,persona,"LinkedIn feed for recruiters"
2027-11-03,"LinkedIn Settings vs Feed Cleaner: Quick Guide",linkedin-settings-vs-feed-cleaner-quick-guide,comparison,"native LinkedIn settings vs feed cleaner"
2027-11-04,"LinkedIn Chrome Extension Guide: Daily Tips",linkedin-chrome-extension-guide-daily-tips,strategy,"LinkedIn chrome extension"
2027-11-05,"Best LinkedIn Ad Blocker Ad Guide",best-linkedin-ad-blocker-ad-guide,ads,"best LinkedIn ad blocker"
2027-11-06,"Hide Reacted Posts on LinkedIn on Chrome",hide-reacted-posts-on-linkedin-on-chrome,reactions,"hide reacted posts on LinkedIn"
2027-11-07,"Why LinkedIn Shows Reposts Now",why-linkedin-shows-reposts-now,shares,"why LinkedIn shows reposts"
2027-11-08,"Why LinkedIn Recommends Posts November 2027",why-linkedin-recommends-posts-november-2027,suggested,"why LinkedIn recommends posts"
2027-11-09,"LinkedIn Feed for Sales Teams: Daily Tips",linkedin-feed-for-sales-teams-daily-tips,persona,"LinkedIn feed for sales teams"
2027-11-10,"LinkTopics vs LinkedIn Premium: Quick Guide",linktopics-vs-linkedin-premium-quick-guide,comparison,"LinkTopics vs LinkedIn Premium"
2027-11-11,"Clean LinkedIn Feed for Focus: Daily Tips",clean-linkedin-feed-for-focus-daily-tips,strategy,"clean LinkedIn feed"
2027-11-12,"Block Promoted Posts on LinkedIn Feed Tips",block-promoted-posts-on-linkedin-feed-tips,ads,"block promoted posts LinkedIn"
2027-11-13,"Why LinkedIn Shows Loves This",why-linkedin-shows-loves-this,reactions,"why LinkedIn shows loves this posts"
2027-11-14,"Why LinkedIn Shows Shared Posts November 2027",why-linkedin-shows-shared-posts-november-2027,shares,"why LinkedIn shows shared posts"
2027-11-15,"Hide LinkedIn Recommended Content: Chrome Guide",hide-linkedin-recommended-content-chrome-guide,suggested,"hide recommended content on LinkedIn"
2027-11-16,"LinkedIn Feed for Marketers Now",linkedin-feed-for-marketers-now,persona,"LinkedIn feed for marketers"
2027-11-17,"LinkTopics vs LinkedIn Ad Blockers: Quick Guide",linktopics-vs-linkedin-ad-blockers-quick-guide,comparison,"LinkTopics vs LinkedIn ad blockers"
2027-11-18,"LinkedIn Feed for Productivity: Daily Tips",linkedin-feed-for-productivity-daily-tips,strategy,"LinkedIn feed productivity"
2027-11-19,"How to Remove LinkedIn Ads: Tips",how-to-remove-linkedin-ads-tips,ads,"remove LinkedIn ads"
2027-11-20,"Hide Celebrates This on LinkedIn on Chrome",hide-celebrates-this-on-linkedin-on-chrome,reactions,"hide celebrates this on LinkedIn"
2027-11-21,"Hide Shared Posts on LinkedIn: Chrome Guide",hide-shared-posts-on-linkedin-chrome-guide,shares,"hide shared posts on LinkedIn"
2027-11-22,"Hide Suggested Posts on LinkedIn: Chrome Guide",hide-suggested-posts-on-linkedin-chrome-guide,suggested,"hide suggested posts on LinkedIn"
2027-11-23,"LinkedIn Feed for Founders 2027",linkedin-feed-for-founders-2027,persona,"LinkedIn feed for founders"
2027-11-24,"Feed Cleaner vs Manual Cleanup: Quick Guide",feed-cleaner-vs-manual-cleanup-quick-guide,comparison,"feed cleaner vs manual cleanup"
2027-11-25,"LinkedIn Focus Mode Guide: Tips",linkedin-focus-mode-guide-tips,strategy,"LinkedIn focus mode"
2027-11-26,"How to Hide Promoted Posts on LinkedIn: Explained",how-to-hide-promoted-posts-on-linkedin-explained,ads,"hide promoted posts on LinkedIn"
2027-11-27,"Hide Insightful Posts on LinkedIn on Chrome",hide-insightful-posts-on-linkedin-on-chrome,reactions,"hide insightful posts on LinkedIn"
2027-11-28,"Hide Reshared Posts on LinkedIn: Chrome Guide",hide-reshared-posts-on-linkedin-chrome-guide,shares,"hide reshared posts on LinkedIn"
2027-11-29,"Hide Recommended Posts on LinkedIn: Chrome Guide",hide-recommended-posts-on-linkedin-chrome-guide,suggested,"hide recommended posts on LinkedIn"
2027-11-30,"LinkedIn Feed for Consultants: Daily Tips",linkedin-feed-for-consultants-daily-tips,persona,"LinkedIn feed for consultants"
2027-12-01,"uBlock Origin for LinkedIn: Quick Guide",ublock-origin-for-linkedin-quick-guide,comparison,"uBlock Origin for LinkedIn"
2027-12-02,"Stop LinkedIn Distractions: Quick Guide",stop-linkedin-distractions-quick-guide,strategy,"stop LinkedIn distractions"
2027-12-03,"Hide Sponsored Posts on LinkedIn: Explained",hide-sponsored-posts-on-linkedin-explained,ads,"hide sponsored posts on LinkedIn"
2027-12-04,"Hide Supports This on LinkedIn on Chrome",hide-supports-this-on-linkedin-on-chrome,reactions,"hide supports this on LinkedIn"
2027-12-05,"Hide Reposted Posts on LinkedIn: Chrome Guide",hide-reposted-posts-on-linkedin-chrome-guide,shares,"hide reposted posts on LinkedIn"
2027-12-06,"Why LinkedIn Suggests Posts December 2027",why-linkedin-suggests-posts-december-2027,suggested,"why LinkedIn suggests posts"
2027-12-07,"LinkedIn Feed for Job Seekers: Daily Tips",linkedin-feed-for-job-seekers-daily-tips,persona,"LinkedIn feed for job seekers"
2027-12-08,"AdBlock on LinkedIn Feed at Work",adblock-on-linkedin-feed-at-work,comparison,"AdBlock for LinkedIn"
2027-12-09,"What a LinkedIn Feed Cleaner Does: Quick Guide",what-a-linkedin-feed-cleaner-does-quick-guide,strategy,"LinkedIn feed cleaner"
2027-12-10,"Best LinkedIn Ad Blocker: Chrome Guide",best-linkedin-ad-blocker-chrome-guide,ads,"best LinkedIn ad blocker"
2027-12-11,"Hide Likes This Posts on LinkedIn on Chrome",hide-likes-this-posts-on-linkedin-on-chrome,reactions,"how to hide likes this posts on LinkedIn"
2027-12-12,"Why LinkedIn Shows Reposts December 2027",why-linkedin-shows-reposts-december-2027,shares,"why LinkedIn shows reposts"
2027-12-13,"Why LinkedIn Recommends Posts December 2027",why-linkedin-recommends-posts-december-2027,suggested,"why LinkedIn recommends posts"
2027-12-14,"LinkedIn Feed for HR Teams 2027",linkedin-feed-for-hr-teams-2027,persona,"LinkedIn feed for HR teams"
2027-12-15,"LinkedIn Settings vs Feed Cleaner: Side by Side",linkedin-settings-vs-feed-cleaner-side-by-side,comparison,"native LinkedIn settings vs feed cleaner"
2027-12-16,"LinkedIn Chrome Extension Guide: Quick Guide",linkedin-chrome-extension-guide-quick-guide,strategy,"LinkedIn chrome extension"
2027-12-17,"Block Promoted Posts on LinkedIn: Explained",block-promoted-posts-on-linkedin-explained,ads,"block promoted posts LinkedIn"
2027-12-18,"Hide Liked Posts on LinkedIn",hide-liked-posts-on-linkedin,reactions,"hide liked posts on LinkedIn"
2027-12-19,"Why LinkedIn Shows Shared Posts December 2027",why-linkedin-shows-shared-posts-december-2027,shares,"why LinkedIn shows shared posts"
2027-12-20,"Hide LinkedIn Recommended Content December 2027",hide-linkedin-recommended-content-december-2027,suggested,"hide recommended content on LinkedIn"
2027-12-21,"LinkedIn Feed for Recruiters",linkedin-feed-for-recruiters,persona,"LinkedIn feed for recruiters"
2027-12-22,"LinkTopics vs LinkedIn Premium: Side by Side",linktopics-vs-linkedin-premium-side-by-side,comparison,"LinkTopics vs LinkedIn Premium"
2027-12-23,"Clean LinkedIn Feed for Focus: Quick Guide",clean-linkedin-feed-for-focus-quick-guide,strategy,"clean LinkedIn feed"
2027-12-24,"How to Remove LinkedIn Ads Fast",how-to-remove-linkedin-ads-fast,ads,"remove LinkedIn ads"
2027-12-25,"Hide Reacted Posts on LinkedIn Quick Fix",hide-reacted-posts-on-linkedin-quick-fix,reactions,"hide reacted posts on LinkedIn"
