date,title,slug,category,keyword
2026-11-29,"Why LinkedIn Shows Shared Posts at Work",why-linkedin-shows-shared-posts-at-work,shares,"why LinkedIn shows shared posts"
2026-11-30,"Hide LinkedIn Recommended Content: Tips",hide-linkedin-recommended-content-tips,suggested,"hide recommended content on LinkedIn"
2026-12-01,"LinkedIn Feed for Sales Teams at Work",linkedin-feed-for-sales-teams-at-work,persona,"LinkedIn feed for sales teams"
2026-12-02,"LinkedIn Settings vs Feed Cleaner: Guide",linkedin-settings-vs-feed-cleaner-guide,comparison,"native LinkedIn settings vs feed cleaner"
2026-12-03,"LinkedIn Chrome Extension Guide: Guide",linkedin-chrome-extension-guide-guide,strategy,"LinkedIn chrome extension"
2026-12-04,"How to Remove LinkedIn Ads Feed Tips",how-to-remove-linkedin-ads-feed-tips,ads,"remove LinkedIn ads"
2026-12-05,"Why LinkedIn Shows Loves This at Work",why-linkedin-shows-loves-this-at-work,reactions,"why LinkedIn shows loves this posts"
2026-12-06,"Hide Shared Posts on LinkedIn Now",hide-shared-posts-on-linkedin-now,shares,"hide shared posts on LinkedIn"
2026-12-07,"Hide Suggested Posts on LinkedIn: Guide",hide-suggested-posts-on-linkedin-guide,suggested,"hide suggested posts on LinkedIn"
2026-12-08,"LinkedIn Feed for Marketers: Playbook",linkedin-feed-for-marketers-playbook,persona,"LinkedIn feed for marketers"
2026-12-09,"LinkTopics vs LinkedIn Premium at Work",linktopics-vs-linkedin-premium-at-work,comparison,"LinkTopics vs LinkedIn Premium"
2026-12-10,"Clean LinkedIn Feed for Focus Now",clean-linkedin-feed-for-focus-now,strategy,"clean LinkedIn feed"
2026-12-11,"How to Hide Promoted Posts on LinkedIn: Guide",how-to-hide-promoted-posts-on-linkedin-guide,ads,"hide promoted posts on LinkedIn"
2026-12-12,"Hide Celebrates This on LinkedIn Today",hide-celebrates-this-on-linkedin-today,reactions,"hide celebrates this on LinkedIn"
2026-12-13,"Hide Reshared Posts on LinkedIn: Setup",hide-reshared-posts-on-linkedin-setup,shares,"hide reshared posts on LinkedIn"
2026-12-14,"Hide Recommended Posts on LinkedIn: Guide",hide-recommended-posts-on-linkedin-guide,suggested,"hide recommended posts on LinkedIn"
2026-12-15,"LinkedIn Feed for Founders: Checklist",linkedin-feed-for-founders-checklist,persona,"LinkedIn feed for founders"
2026-12-16,"LinkTopics vs LinkedIn Ad Blockers: Review",linktopics-vs-linkedin-ad-blockers-review,comparison,"LinkTopics vs LinkedIn ad blockers"
2026-12-17,"LinkedIn Feed for Productivity at Work",linkedin-feed-for-productivity-at-work,strategy,"LinkedIn feed productivity"
2026-12-18,"Hide Sponsored Posts on LinkedIn: Guide",hide-sponsored-posts-on-linkedin-guide,ads,"hide sponsored posts on LinkedIn"
2026-12-19,"Hide Insightful Posts on LinkedIn Today",hide-insightful-posts-on-linkedin-today,reactions,"hide insightful posts on LinkedIn"
2026-12-20,"Hide Reposted Posts on LinkedIn: Setup",hide-reposted-posts-on-linkedin-setup,shares,"hide reposted posts on LinkedIn"
2026-12-21,"Why LinkedIn Suggests Posts 2026",why-linkedin-suggests-posts-2026,suggested,"why LinkedIn suggests posts"
2026-12-22,"LinkedIn Feed for Consultants at Work",linkedin-feed-for-consultants-at-work,persona,"LinkedIn feed for consultants"
2026-12-23,"Feed Cleaner vs Manual Cleanup at Work",feed-cleaner-vs-manual-cleanup-at-work,comparison,"feed cleaner vs manual cleanup"
2026-12-24,"LinkedIn Focus Mode Guide: Daily Tips",linkedin-focus-mode-guide-daily-tips,strategy,"LinkedIn focus mode"
2026-12-25,"Best LinkedIn Ad Blocker Work Tips",best-linkedin-ad-blocker-work-tips,ads,"best LinkedIn ad blocker"
2026-12-26,"Hide Supports This on LinkedIn: Tips",hide-supports-this-on-linkedin-tips,reactions,"hide supports this on LinkedIn"
2026-12-27,"Why LinkedIn Shows Reposts Today",why-linkedin-shows-reposts-today,shares,"why LinkedIn shows reposts"
2026-12-28,"Why LinkedIn Recommends Posts on Chrome",why-linkedin-recommends-posts-on-chrome,suggested,"why LinkedIn recommends posts"
2026-12-29,"LinkedIn Feed for Job Seekers at Work",linkedin-feed-for-job-seekers-at-work,persona,"LinkedIn feed for job seekers"
2026-12-30,"uBlock Origin for LinkedIn: Explained",ublock-origin-for-linkedin-explained,comparison,"uBlock Origin for LinkedIn"
2026-12-31,"Stop LinkedIn Distractions: Tips",stop-linkedin-distractions-tips,strategy,"stop LinkedIn distractions"
2027-01-01,"Block Promoted Posts on LinkedIn 2027",block-promoted-posts-on-linkedin-2027,ads,"block promoted posts LinkedIn"
2027-01-02,"Hide Likes This Posts on LinkedIn 2027",hide-likes-this-posts-on-linkedin-2027,reactions,"how to hide likes this posts on LinkedIn"
2027-01-03,"Why LinkedIn Shows Shared Posts 2027",why-linkedin-shows-shared-posts-2027,shares,"why LinkedIn shows shared posts"
2027-01-04,"Hide LinkedIn Recommended Content 2027",hide-linkedin-recommended-content-2027,suggested,"hide recommended content on LinkedIn"
2027-01-05,"LinkedIn Feed for HR Teams: Checklist",linkedin-feed-for-hr-teams-checklist,persona,"LinkedIn feed for HR teams"
2027-01-06,"AdBlock on LinkedIn Feed January 2027",adblock-on-linkedin-feed-january-2027,comparison,"AdBlock for LinkedIn"
2027-01-07,"What a LinkedIn Feed Cleaner Does 2027",what-a-linkedin-feed-cleaner-does-2027,strategy,"LinkedIn feed cleaner"
2027-01-08,"How to Remove LinkedIn Ads: Guide",how-to-remove-linkedin-ads-guide,ads,"remove LinkedIn ads"
2027-01-09,"Hide Liked Posts on LinkedIn Fast",hide-liked-posts-on-linkedin-fast,reactions,"hide liked posts on LinkedIn"
2027-01-10,"Hide Shared Posts on LinkedIn 2027",hide-shared-posts-on-linkedin-2027,shares,"hide shared posts on LinkedIn"
2027-01-11,"Hide Suggested Posts on LinkedIn 2027",hide-suggested-posts-on-linkedin-2027,suggested,"hide suggested posts on LinkedIn"
2027-01-12,"LinkedIn Feed for Recruiters 2027",linkedin-feed-for-recruiters-2027,persona,"LinkedIn feed for recruiters"
2027-01-13,"LinkedIn Settings vs Feed Cleaner 2027",linkedin-settings-vs-feed-cleaner-2027,comparison,"native LinkedIn settings vs feed cleaner"
2027-01-14,"LinkedIn Chrome Extension Guide 2027",linkedin-chrome-extension-guide-2027,strategy,"LinkedIn chrome extension"
2027-01-15,"How to Hide Promoted Posts on LinkedIn 2027",how-to-hide-promoted-posts-on-linkedin-2027,ads,"hide promoted posts on LinkedIn"
2027-01-16,"Hide Reacted Posts on LinkedIn 2027",hide-reacted-posts-on-linkedin-2027,reactions,"hide reacted posts on LinkedIn"
2027-01-17,"Hide Reshared Posts on LinkedIn 2027",hide-reshared-posts-on-linkedin-2027,shares,"hide reshared posts on LinkedIn"
2027-01-18,"Hide Recommended Posts on LinkedIn 2027",hide-recommended-posts-on-linkedin-2027,suggested,"hide recommended posts on LinkedIn"
2027-01-19,"LinkedIn Feed for Sales Teams 2027",linkedin-feed-for-sales-teams-2027,persona,"LinkedIn feed for sales teams"
2027-01-20,"LinkTopics vs LinkedIn Premium 2027",linktopics-vs-linkedin-premium-2027,comparison,"LinkTopics vs LinkedIn Premium"
2027-01-21,"Clean LinkedIn Feed for Focus 2027",clean-linkedin-feed-for-focus-2027,strategy,"clean LinkedIn feed"
2027-01-22,"Hide Sponsored Posts on LinkedIn 2027",hide-sponsored-posts-on-linkedin-2027,ads,"hide sponsored posts on LinkedIn"
2027-01-23,"Why LinkedIn Shows Loves This 2027",why-linkedin-shows-loves-this-2027,reactions,"why LinkedIn shows loves this posts"
2027-01-24,"Hide Reposted Posts on LinkedIn 2027",hide-reposted-posts-on-linkedin-2027,shares,"hide reposted posts on LinkedIn"
2027-01-25,"Why LinkedIn Suggests Posts 2027",why-linkedin-suggests-posts-2027,suggested,"why LinkedIn suggests posts"
2027-01-26,"LinkedIn Feed for Marketers Today",linkedin-feed-for-marketers-today,persona,"LinkedIn feed for marketers"
2027-01-27,"LinkTopics vs LinkedIn Ad Blockers 2027",linktopics-vs-linkedin-ad-blockers-2027,comparison,"LinkTopics vs LinkedIn ad blockers"
2027-01-28,"LinkedIn Feed for Productivity 2027",linkedin-feed-for-productivity-2027,strategy,"LinkedIn feed productivity"
2027-01-29,"Best LinkedIn Ad Blocker Feed Tips",best-linkedin-ad-blocker-feed-tips,ads,"best LinkedIn ad blocker"
2027-01-30,"Hide Celebrates This on LinkedIn 2027",hide-celebrates-this-on-linkedin-2027,reactions,"hide celebrates this on LinkedIn"
2027-01-31,"Why LinkedIn Shows Reposts 2027",why-linkedin-shows-reposts-2027,shares,"why LinkedIn shows reposts"
2027-02-01,"Why LinkedIn Recommends Posts 2027",why-linkedin-recommends-posts-2027,suggested,"why LinkedIn recommends posts"
2027-02-02,"LinkedIn Feed for Founders: Tips",linkedin-feed-for-founders-tips,persona,"LinkedIn feed for founders"
2027-02-03,"Feed Cleaner vs Manual Cleanup 2027",feed-cleaner-vs-manual-cleanup-2027,comparison,"feed cleaner vs manual cleanup"
2027-02-04,"LinkedIn Focus Mode Guide: Guide",linkedin-focus-mode-guide-guide,strategy,"LinkedIn focus mode"
2027-02-05,"Block Promoted Posts on LinkedIn: Guide",block-promoted-posts-on-linkedin-guide,ads,"block promoted posts LinkedIn"
2027-02-06,"Hide Insightful Posts on LinkedIn 2027",hide-insightful-posts-on-linkedin-2027,reactions,"hide insightful posts on LinkedIn"
2027-02-07,"Why LinkedIn Shows Shared Posts for Work",why-linkedin-shows-shared-posts-for-work,shares,"why LinkedIn shows shared posts"
2027-02-08,"Hide LinkedIn Recommended Content: Guide",hide-linkedin-recommended-content-guide,suggested,"hide recommended content on LinkedIn"
2027-02-09,"LinkedIn Feed for Consultants 2027",linkedin-feed-for-consultants-2027,persona,"LinkedIn feed for consultants"
2027-02-10,"uBlock Origin for LinkedIn: Checklist",ublock-origin-for-linkedin-checklist,comparison,"uBlock Origin for LinkedIn"
2027-02-11,"Stop LinkedIn Distractions: Daily Tips",stop-linkedin-distractions-daily-tips,strategy,"stop LinkedIn distractions"
2027-02-12,"How to Remove LinkedIn Ads: Explained",how-to-remove-linkedin-ads-explained,ads,"remove LinkedIn ads"
2027-02-13,"Hide Supports This on LinkedIn 2027",hide-supports-this-on-linkedin-2027,reactions,"hide supports this on LinkedIn"
2027-02-14,"Hide Shared Posts on LinkedIn at Work",hide-shared-posts-on-linkedin-at-work,shares,"hide shared posts on LinkedIn"
2027-02-15,"Hide Suggested Posts on LinkedIn: Setup",hide-suggested-posts-on-linkedin-setup,suggested,"hide suggested posts on LinkedIn"
2027-02-16,"LinkedIn Feed for Job Seekers 2027",linkedin-feed-for-job-seekers-2027,persona,"LinkedIn feed for job seekers"
2027-02-17,"AdBlock on LinkedIn Feed: Review",adblock-on-linkedin-feed-review,comparison,"AdBlock for LinkedIn"
2027-02-18,"What a LinkedIn Feed Cleaner Does: Guide",what-a-linkedin-feed-cleaner-does-guide,strategy,"LinkedIn feed cleaner"
2027-02-19,"How to Hide Promoted Posts on LinkedIn: Setup",how-to-hide-promoted-posts-on-linkedin-setup,ads,"hide promoted posts on LinkedIn"
2027-02-20,"Hide Likes This Posts on LinkedIn Today",hide-likes-this-posts-on-linkedin-today,reactions,"how to hide likes this posts on LinkedIn"
2027-02-21,"Hide Reshared Posts on LinkedIn",hide-reshared-posts-on-linkedin,shares,"hide reshared posts on LinkedIn"
2027-02-22,"Hide Recommended Posts on LinkedIn: Setup",hide-recommended-posts-on-linkedin-setup,suggested,"hide recommended posts on LinkedIn"
2027-02-23,"LinkedIn Feed for HR Teams: Tips",linkedin-feed-for-hr-teams-tips,persona,"LinkedIn feed for HR teams"
2027-02-24,"LinkedIn Settings vs Feed Cleaner: Review",linkedin-settings-vs-feed-cleaner-review,comparison,"native LinkedIn settings vs feed cleaner"
2027-02-25,"LinkedIn Chrome Extension Guide",linkedin-chrome-extension-guide,strategy,"LinkedIn chrome extension"
2027-02-26,"Hide Sponsored Posts on LinkedIn: Setup",hide-sponsored-posts-on-linkedin-setup,ads,"hide sponsored posts on LinkedIn"
2027-02-27,"Hide Liked Posts on LinkedIn 2027",hide-liked-posts-on-linkedin-2027,reactions,"hide liked posts on LinkedIn"
2027-02-28,"Hide Reposted Posts on LinkedIn",hide-reposted-posts-on-linkedin,shares,"hide reposted posts on LinkedIn"
2027-03-01,"Why LinkedIn Suggests Posts: Explained",why-linkedin-suggests-posts-explained,suggested,"why LinkedIn suggests posts"
2027-03-02,"LinkedIn Feed for Recruiters for Work",linkedin-feed-for-recruiters-for-work,persona,"LinkedIn feed for recruiters"
2027-03-03,"LinkTopics vs LinkedIn Premium Compared",linktopics-vs-linkedin-premium-compared,comparison,"LinkTopics vs LinkedIn Premium"
2027-03-04,"Clean LinkedIn Feed for Focus for Work",clean-linkedin-feed-for-focus-for-work,strategy,"clean LinkedIn feed"
2027-03-05,"Best LinkedIn Ad Blocker March 2027",best-linkedin-ad-blocker-march-2027,ads,"best LinkedIn ad blocker"
2027-03-06,"Hide Reacted Posts on LinkedIn: Guide",hide-reacted-posts-on-linkedin-guide,reactions,"hide reacted posts on LinkedIn"
2027-03-07,"Why LinkedIn Shows Reposts March 2027",why-linkedin-shows-reposts-march-2027,shares,"why LinkedIn shows reposts"
2027-03-08,"Why LinkedIn Recommends Posts Quick Fix",why-linkedin-recommends-posts-quick-fix,suggested,"why LinkedIn recommends posts"
2027-03-09,"LinkedIn Feed for Sales Teams Now",linkedin-feed-for-sales-teams-now,persona,"LinkedIn feed for sales teams"
2027-03-10,"LinkTopics vs LinkedIn Ad Blockers at Work",linktopics-vs-linkedin-ad-blockers-at-work,comparison,"LinkTopics vs LinkedIn ad blockers"
2027-03-11,"LinkedIn Feed for Productivity for Work",linkedin-feed-for-productivity-for-work,strategy,"LinkedIn feed productivity"
2027-03-12,"Block Promoted Posts on LinkedIn: Setup",block-promoted-posts-on-linkedin-setup,ads,"block promoted posts LinkedIn"
2027-03-13,"Why LinkedIn Shows Loves This for Work",why-linkedin-shows-loves-this-for-work,reactions,"why LinkedIn shows loves this posts"
2027-03-14,"Why LinkedIn Shows Shared Posts on Chrome",why-linkedin-shows-shared-posts-on-chrome,shares,"why LinkedIn shows shared posts"
2027-03-15,"Hide LinkedIn Recommended Content: Setup",hide-linkedin-recommended-content-setup,suggested,"hide recommended content on LinkedIn"
2027-03-16,"LinkedIn Feed for Marketers 2027",linkedin-feed-for-marketers-2027,persona,"LinkedIn feed for marketers"
2027-03-17,"Feed Cleaner vs Manual Cleanup Compared",feed-cleaner-vs-manual-cleanup-compared,comparison,"feed cleaner vs manual cleanup"
2027-03-18,"LinkedIn Focus Mode Guide March 2027",linkedin-focus-mode-guide-march-2027,strategy,"LinkedIn focus mode"
2027-03-19,"How to Remove LinkedIn Ads: Setup",how-to-remove-linkedin-ads-setup,ads,"remove LinkedIn ads"
2027-03-20,"Hide Celebrates This on LinkedIn: Tips",hide-celebrates-this-on-linkedin-tips,reactions,"hide celebrates this on LinkedIn"
2027-03-21,"Hide Shared Posts on LinkedIn for Work",hide-shared-posts-on-linkedin-for-work,shares,"hide shared posts on LinkedIn"
2027-03-22,"Hide Suggested Posts on LinkedIn at Work",hide-suggested-posts-on-linkedin-at-work,suggested,"hide suggested posts on LinkedIn"
2027-03-23,"LinkedIn Feed for Founders March 2027",linkedin-feed-for-founders-march-2027,persona,"LinkedIn feed for founders"
2027-03-24,"uBlock Origin for LinkedIn March 2027",ublock-origin-for-linkedin-march-2027,comparison,"uBlock Origin for LinkedIn"
2027-03-25,"Stop LinkedIn Distractions March 2027",stop-linkedin-distractions-march-2027,strategy,"stop LinkedIn distractions"
2027-03-26,"How to Hide Promoted Posts on LinkedIn at Work",how-to-hide-promoted-posts-on-linkedin-at-work,ads,"hide promoted posts on LinkedIn"
2027-03-27,"Hide Insightful Posts on LinkedIn: Tips",hide-insightful-posts-on-linkedin-tips,reactions,"hide insightful posts on LinkedIn"
2027-03-28,"Hide Reshared Posts on LinkedIn at Work",hide-reshared-posts-on-linkedin-at-work,shares,"hide reshared posts on LinkedIn"
2027-03-29,"Hide Recommended Posts on LinkedIn at Work",hide-recommended-posts-on-linkedin-at-work,suggested,"hide recommended posts on LinkedIn"
2027-03-30,"LinkedIn Feed for Consultants Now",linkedin-feed-for-consultants-now,persona,"LinkedIn feed for consultants"
2027-03-31,"AdBlock on LinkedIn Feed March 2027",adblock-on-linkedin-feed-march-2027,comparison,"AdBlock for LinkedIn"
2027-04-01,"What a LinkedIn Feed Cleaner Does at Work",what-a-linkedin-feed-cleaner-does-at-work,strategy,"LinkedIn feed cleaner"
2027-04-02,"Hide Sponsored Posts on LinkedIn at Work",hide-sponsored-posts-on-linkedin-at-work,ads,"hide sponsored posts on LinkedIn"
2027-04-03,"Hide Supports This on LinkedIn: Guide",hide-supports-this-on-linkedin-guide,reactions,"hide supports this on LinkedIn"
2027-04-04,"Hide Reposted Posts on LinkedIn at Work",hide-reposted-posts-on-linkedin-at-work,shares,"hide reposted posts on LinkedIn"
2027-04-05,"Why LinkedIn Suggests Posts April 2027",why-linkedin-suggests-posts-april-2027,suggested,"why LinkedIn suggests posts"
2027-04-06,"LinkedIn Feed for Job Seekers Now",linkedin-feed-for-job-seekers-now,persona,"LinkedIn feed for job seekers"
2027-04-07,"LinkedIn Settings vs Feed Cleaner at Work",linkedin-settings-vs-feed-cleaner-at-work,comparison,"native LinkedIn settings vs feed cleaner"
2027-04-08,"LinkedIn Chrome Extension Guide at Work",linkedin-chrome-extension-guide-at-work,strategy,"LinkedIn chrome extension"
2027-04-09,"Best LinkedIn Ad Blocker April 2027",best-linkedin-ad-blocker-april-2027,ads,"best LinkedIn ad blocker"
2027-04-10,"Hide Likes This Posts on LinkedIn: Tips",hide-likes-this-posts-on-linkedin-tips,reactions,"how to hide likes this posts on LinkedIn"
2027-04-11,"Why LinkedIn Shows Reposts April 2027",why-linkedin-shows-reposts-april-2027,shares,"why LinkedIn shows reposts"
2027-04-12,"Why LinkedIn Recommends Posts: Explained",why-linkedin-recommends-posts-explained,suggested,"why LinkedIn recommends posts"
2027-04-13,"LinkedIn Feed for HR Teams April 2027",linkedin-feed-for-hr-teams-april-2027,persona,"LinkedIn feed for HR teams"
2027-04-14,"LinkTopics vs LinkedIn Premium",linktopics-vs-linkedin-premium,comparison,"LinkTopics vs LinkedIn Premium"
2027-04-15,"Clean LinkedIn Feed for Focus: Explained",clean-linkedin-feed-for-focus-explained,strategy,"clean LinkedIn feed"
2027-04-16,"Block Promoted Posts on LinkedIn at Work",block-promoted-posts-on-linkedin-at-work,ads,"block promoted posts LinkedIn"
2027-04-17,"Hide Liked Posts on LinkedIn for Work",hide-liked-posts-on-linkedin-for-work,reactions,"hide liked posts on LinkedIn"
2027-04-18,"Why LinkedIn Shows Shared Posts Quick Fix",why-linkedin-shows-shared-posts-quick-fix,shares,"why LinkedIn shows shared posts"
2027-04-19,"Hide LinkedIn Recommended Content at Work",hide-linkedin-recommended-content-at-work,suggested,"hide recommended content on LinkedIn"
2027-04-20,"LinkedIn Feed for Recruiters: Playbook",linkedin-feed-for-recruiters-playbook,persona,"LinkedIn feed for recruiters"
2027-04-21,"LinkTopics vs LinkedIn Ad Blockers Compared",linktopics-vs-linkedin-ad-blockers-compared,comparison,"LinkTopics vs LinkedIn ad blockers"
2027-04-22,"LinkedIn Feed for Productivity",linkedin-feed-for-productivity,strategy,"LinkedIn feed productivity"
2027-04-23,"How to Remove LinkedIn Ads Less Noise",how-to-remove-linkedin-ads-less-noise,ads,"remove LinkedIn ads"
2027-04-24,"Hide Reacted Posts on LinkedIn: Setup",hide-reacted-posts-on-linkedin-setup,reactions,"hide reacted posts on LinkedIn"
2027-04-25,"Hide Shared Posts on LinkedIn on Chrome",hide-shared-posts-on-linkedin-on-chrome,shares,"hide shared posts on LinkedIn"
2027-04-26,"Hide Suggested Posts on LinkedIn for Work",hide-suggested-posts-on-linkedin-for-work,suggested,"hide suggested posts on LinkedIn"
2027-04-27,"LinkedIn Feed for Sales Teams for Work",linkedin-feed-for-sales-teams-for-work,persona,"LinkedIn feed for sales teams"
2027-04-28,"Feed Cleaner vs Manual Cleanup",feed-cleaner-vs-manual-cleanup,comparison,"feed cleaner vs manual cleanup"
2027-04-29,"LinkedIn Focus Mode Guide April 2027",linkedin-focus-mode-guide-april-2027,strategy,"LinkedIn focus mode"
2027-04-30,"How to Hide Promoted Posts on LinkedIn for Work",how-to-hide-promoted-posts-on-linkedin-for-work,ads,"hide promoted posts on LinkedIn"
2027-05-01,"Why LinkedIn Shows Loves This May 2027",why-linkedin-shows-loves-this-may-2027,reactions,"why LinkedIn shows loves this posts"
2027-05-02,"Hide Reshared Posts on LinkedIn for Work",hide-reshared-posts-on-linkedin-for-work,shares,"hide reshared posts on LinkedIn"
2027-05-03,"Hide Recommended Posts on LinkedIn for Work",hide-recommended-posts-on-linkedin-for-work,suggested,"hide recommended posts on LinkedIn"
2027-05-04,"LinkedIn Feed for Marketers May 2027",linkedin-feed-for-marketers-may-2027,persona,"LinkedIn feed for marketers"
2027-05-05,"uBlock Origin for LinkedIn May 2027",ublock-origin-for-linkedin-may-2027,comparison,"uBlock Origin for LinkedIn"
2027-05-06,"Stop LinkedIn Distractions May 2027",stop-linkedin-distractions-may-2027,strategy,"stop LinkedIn distractions"
2027-05-07,"Hide Sponsored Posts on LinkedIn for Work",hide-sponsored-posts-on-linkedin-for-work,ads,"hide sponsored posts on LinkedIn"
2027-05-08,"Hide Celebrates This on LinkedIn: Guide",hide-celebrates-this-on-linkedin-guide,reactions,"hide celebrates this on LinkedIn"
2027-05-09,"Hide Reposted Posts on LinkedIn for Work",hide-reposted-posts-on-linkedin-for-work,shares,"hide reposted posts on LinkedIn"
2027-05-10,"Why LinkedIn Suggests Posts May 2027",why-linkedin-suggests-posts-may-2027,suggested,"why LinkedIn suggests posts"
2027-05-11,"LinkedIn Feed for Founders May 2027",linkedin-feed-for-founders-may-2027,persona,"LinkedIn feed for founders"
2027-05-12,"AdBlock on LinkedIn Feed May 2027",adblock-on-linkedin-feed-may-2027,comparison,"AdBlock for LinkedIn"
2027-05-13,"What a LinkedIn Feed Cleaner Does for Work",what-a-linkedin-feed-cleaner-does-for-work,strategy,"LinkedIn feed cleaner"
2027-05-14,"Best LinkedIn Ad Blocker for Work",best-linkedin-ad-blocker-for-work,ads,"best LinkedIn ad blocker"
2027-05-15,"Hide Insightful Posts on LinkedIn: Guide",hide-insightful-posts-on-linkedin-guide,reactions,"hide insightful posts on LinkedIn"
2027-05-16,"Why LinkedIn Shows Reposts May 2027",why-linkedin-shows-reposts-may-2027,shares,"why LinkedIn shows reposts"
2027-05-17,"Why LinkedIn Recommends Posts May 2027",why-linkedin-recommends-posts-may-2027,suggested,"why LinkedIn recommends posts"
2027-05-18,"LinkedIn Feed for Consultants for Work",linkedin-feed-for-consultants-for-work,persona,"LinkedIn feed for consultants"
2027-05-19,"LinkedIn Settings vs Feed Cleaner Compared",linkedin-settings-vs-feed-cleaner-compared,comparison,"native LinkedIn settings vs feed cleaner"
2027-05-20,"LinkedIn Chrome Extension Guide for Work",linkedin-chrome-extension-guide-for-work,strategy,"LinkedIn chrome extension"
2027-05-21,"Block Promoted Posts on LinkedIn for Work",block-promoted-posts-on-linkedin-for-work,ads,"block promoted posts LinkedIn"
2027-05-22,"Hide Supports This on LinkedIn: Setup",hide-supports-this-on-linkedin-setup,reactions,"hide supports this on LinkedIn"
2027-05-23,"Why LinkedIn Shows Shared Posts May 2027",why-linkedin-shows-shared-posts-may-2027,shares,"why LinkedIn shows shared posts"
2027-05-24,"Hide LinkedIn Recommended Content for Work",hide-linkedin-recommended-content-for-work,suggested,"hide recommended content on LinkedIn"
2027-05-25,"LinkedIn Feed for Job Seekers for Work",linkedin-feed-for-job-seekers-for-work,persona,"LinkedIn feed for job seekers"
2027-05-26,"LinkTopics vs LinkedIn Premium May 2027",linktopics-vs-linkedin-premium-may-2027,comparison,"LinkTopics vs LinkedIn Premium"
2027-05-27,"Clean LinkedIn Feed for Focus May 2027",clean-linkedin-feed-for-focus-may-2027,strategy,"clean LinkedIn feed"
2027-05-28,"How to Remove LinkedIn Ads May 2027",how-to-remove-linkedin-ads-may-2027,ads,"remove LinkedIn ads"
2027-05-29,"Hide Likes This Posts on LinkedIn: Guide",hide-likes-this-posts-on-linkedin-guide,reactions,"how to hide likes this posts on LinkedIn"
2027-05-30,"Hide Shared Posts on LinkedIn May 2027",hide-shared-posts-on-linkedin-may-2027,shares,"hide shared posts on LinkedIn"
2027-05-31,"Hide Suggested Posts on LinkedIn May 2027",hide-suggested-posts-on-linkedin-may-2027,suggested,"hide suggested posts on LinkedIn"
2027-06-01,"LinkedIn Feed for HR Teams June 2027",linkedin-feed-for-hr-teams-june-2027,persona,"LinkedIn feed for HR teams"
2027-06-02,"LinkTopics vs LinkedIn Ad Blockers on Chrome",linktopics-vs-linkedin-ad-blockers-on-chrome,comparison,"LinkTopics vs LinkedIn ad blockers"
2027-06-03,"LinkedIn Feed for Productivity June 2027",linkedin-feed-for-productivity-june-2027,strategy,"LinkedIn feed productivity"
2027-06-04,"How to Hide Promoted Posts on LinkedIn Ad Guide",how-to-hide-promoted-posts-on-linkedin-ad-guide,ads,"hide promoted posts on LinkedIn"
2027-06-05,"Hide Liked Posts on LinkedIn Now",hide-liked-posts-on-linkedin-now,reactions,"hide liked posts on LinkedIn"
2027-06-06,"Hide Reshared Posts on LinkedIn on Chrome",hide-reshared-posts-on-linkedin-on-chrome,shares,"hide reshared posts on LinkedIn"
2027-06-07,"Hide Recommended Posts on LinkedIn on Chrome",hide-recommended-posts-on-linkedin-on-chrome,suggested,"hide recommended posts on LinkedIn"
2027-06-08,"LinkedIn Feed for Recruiters Now",linkedin-feed-for-recruiters-now,persona,"LinkedIn feed for recruiters"
2027-06-09,"Feed Cleaner vs Manual Cleanup on Chrome",feed-cleaner-vs-manual-cleanup-on-chrome,comparison,"feed cleaner vs manual cleanup"
2027-06-10,"LinkedIn Focus Mode Guide June 2027",linkedin-focus-mode-guide-june-2027,strategy,"LinkedIn focus mode"
2027-06-11,"Hide Sponsored Posts on LinkedIn Ad Guide",hide-sponsored-posts-on-linkedin-ad-guide,ads,"hide sponsored posts on LinkedIn"
2027-06-12,"Hide Reacted Posts on LinkedIn at Work",hide-reacted-posts-on-linkedin-at-work,reactions,"hide reacted posts on LinkedIn"
2027-06-13,"Hide Reposted Posts on LinkedIn on Chrome",hide-reposted-posts-on-linkedin-on-chrome,shares,"hide reposted posts on LinkedIn"
2027-06-14,"Why LinkedIn Suggests Posts June 2027",why-linkedin-suggests-posts-june-2027,suggested,"why LinkedIn suggests posts"
2027-06-15,"LinkedIn Feed for Sales Teams: Playbook",linkedin-feed-for-sales-teams-playbook,persona,"LinkedIn feed for sales teams"
