date,title,slug,category,keyword
2027-12-26,"Hide Shared Posts on LinkedIn December 2027",hide-shared-posts-on-linkedin-december-2027,shares,"hide shared posts on LinkedIn"
2027-12-27,"Hide Suggested Posts on LinkedIn December 2027",hide-suggested-posts-on-linkedin-december-2027,suggested,"hide suggested posts on LinkedIn"
2027-12-28,"LinkedIn Feed for Sales Teams: Quick Guide",linkedin-feed-for-sales-teams-quick-guide,persona,"LinkedIn feed for sales teams"
2027-12-29,"LinkTopics vs LinkedIn Ad Blockers: Side by Side",linktopics-vs-linkedin-ad-blockers-side-by-side,comparison,"LinkTopics vs LinkedIn ad blockers"
2027-12-30,"LinkedIn Feed for Productivity: Quick Guide",linkedin-feed-for-productivity-quick-guide,strategy,"LinkedIn feed productivity"
2027-12-31,"How to Hide Promoted Posts on LinkedIn Less Noise",how-to-hide-promoted-posts-on-linkedin-less-noise,ads,"hide promoted posts on LinkedIn"
