date,title,slug,category,keyword
2026-05-08,"How to Remove LinkedIn Ads for Work",how-to-remove-linkedin-ads-for-work,ads,"remove LinkedIn ads"
2026-05-09,"Hide Liked Posts on LinkedIn: Guide",hide-liked-posts-on-linkedin-guide,reactions,"hide liked posts on LinkedIn"
2026-05-10,"Hide Shared Posts on LinkedIn Today",hide-shared-posts-on-linkedin-today,shares,"hide shared posts on LinkedIn"
2026-05-11,"Hide Suggested Posts on LinkedIn Now",hide-suggested-posts-on-linkedin-now,suggested,"hide suggested posts on LinkedIn"
2026-05-12,"LinkedIn Feed for Recruiters: Guide",linkedin-feed-for-recruiters-guide,persona,"LinkedIn feed for recruiters"
2026-05-13,"LinkTopics vs LinkedIn Premium 2026",linktopics-vs-linkedin-premium-2026,comparison,"LinkTopics vs LinkedIn Premium"
2026-05-14,"Clean LinkedIn Feed for Focus: Tips",clean-linkedin-feed-for-focus-tips,strategy,"clean LinkedIn feed"
2026-05-15,"How to Hide Promoted Posts on LinkedIn",how-to-hide-promoted-posts-on-linkedin,ads,"hide promoted posts on LinkedIn"
2026-05-16,"Hide Reacted Posts on LinkedIn Fast",hide-reacted-posts-on-linkedin-fast,reactions,"hide reacted posts on LinkedIn"
2026-05-17,"Hide Reshared Posts on LinkedIn Now",hide-reshared-posts-on-linkedin-now,shares,"hide reshared posts on LinkedIn"
2026-05-18,"Hide Recommended Posts on LinkedIn",hide-recommended-posts-on-linkedin,suggested,"hide recommended posts on LinkedIn"
2026-05-19,"LinkedIn Feed for Sales Teams: Tips",linkedin-feed-for-sales-teams-tips,persona,"LinkedIn feed for sales teams"
2026-05-20,"LinkTopics vs LinkedIn Ad Blockers",linktopics-vs-linkedin-ad-blockers,comparison,"LinkTopics vs LinkedIn ad blockers"
2026-05-21,"LinkedIn Feed for Productivity 2026",linkedin-feed-for-productivity-2026,strategy,"LinkedIn feed productivity"
2026-05-22,"Hide Sponsored Posts on LinkedIn Now",hide-sponsored-posts-on-linkedin-now,ads,"hide sponsored posts on LinkedIn"
2026-05-23,"Why LinkedIn Shows Loves This Today",why-linkedin-shows-loves-this-today,reactions,"why LinkedIn shows loves this posts"
2026-05-24,"Hide Reposted Posts on LinkedIn Now",hide-reposted-posts-on-linkedin-now,shares,"hide reposted posts on LinkedIn"
2026-05-25,"Why LinkedIn Suggests Posts at Work",why-linkedin-suggests-posts-at-work,suggested,"why LinkedIn suggests posts"
2026-05-26,"LinkedIn Feed for Marketers at Work",linkedin-feed-for-marketers-at-work,persona,"LinkedIn feed for marketers"
2026-05-27,"Feed Cleaner vs Manual Cleanup 2026",feed-cleaner-vs-manual-cleanup-2026,comparison,"feed cleaner vs manual cleanup"
2026-05-28,"LinkedIn Focus Mode Guide for Work",linkedin-focus-mode-guide-for-work,strategy,"LinkedIn focus mode"
2026-05-29,"Best LinkedIn Ad Blocker: Explained",best-linkedin-ad-blocker-explained,ads,"best LinkedIn ad blocker"
2026-05-30,"Hide Celebrates This on LinkedIn Now",hide-celebrates-this-on-linkedin-now,reactions,"hide celebrates this on LinkedIn"
2026-05-31,"Why LinkedIn Shows Reposts for Work",why-linkedin-shows-reposts-for-work,shares,"why LinkedIn shows reposts"
2026-06-01,"Why LinkedIn Recommends Posts Today",why-linkedin-recommends-posts-today,suggested,"why LinkedIn recommends posts"
2026-06-02,"LinkedIn Feed for Founders for Work",linkedin-feed-for-founders-for-work,persona,"LinkedIn feed for founders"
2026-06-03,"uBlock Origin for LinkedIn Compared",ublock-origin-for-linkedin-compared,comparison,"uBlock Origin for LinkedIn"
2026-06-04,"Stop LinkedIn Distractions for Work",stop-linkedin-distractions-for-work,strategy,"stop LinkedIn distractions"
2026-06-05,"Block Promoted Posts on LinkedIn Now",block-promoted-posts-on-linkedin-now,ads,"block promoted posts LinkedIn"
2026-06-06,"Hide Insightful Posts on LinkedIn",hide-insightful-posts-on-linkedin,reactions,"hide insightful posts on LinkedIn"
2026-06-07,"Why LinkedIn Shows Shared Posts Now",why-linkedin-shows-shared-posts-now,shares,"why LinkedIn shows shared posts"
2026-06-08,"Hide LinkedIn Recommended Content",hide-linkedin-recommended-content,suggested,"hide recommended content on LinkedIn"
2026-06-09,"LinkedIn Feed for Consultants: Tips",linkedin-feed-for-consultants-tips,persona,"LinkedIn feed for consultants"
2026-06-10,"AdBlock on LinkedIn Feed: Explained",adblock-on-linkedin-feed-explained,comparison,"AdBlock for LinkedIn"
2026-06-11,"What a LinkedIn Feed Cleaner Does",what-a-linkedin-feed-cleaner-does,strategy,"LinkedIn feed cleaner"
2026-06-12,"How to Remove LinkedIn Ads Ad Guide",how-to-remove-linkedin-ads-ad-guide,ads,"remove LinkedIn ads"
2026-06-13,"Hide Supports This on LinkedIn Fast",hide-supports-this-on-linkedin-fast,reactions,"hide supports this on LinkedIn"
2026-06-14,"Hide Shared Posts on LinkedIn: Tips",hide-shared-posts-on-linkedin-tips,shares,"hide shared posts on LinkedIn"
2026-06-15,"Hide Suggested Posts on LinkedIn Fast",hide-suggested-posts-on-linkedin-fast,suggested,"hide suggested posts on LinkedIn"
2026-06-16,"LinkedIn Feed for Job Seekers: Tips",linkedin-feed-for-job-seekers-tips,persona,"LinkedIn feed for job seekers"
2026-06-17,"LinkedIn Settings vs Feed Cleaner",linkedin-settings-vs-feed-cleaner,comparison,"native LinkedIn settings vs feed cleaner"
2026-06-18,"LinkedIn Chrome Extension Guide Now",linkedin-chrome-extension-guide-now,strategy,"LinkedIn chrome extension"
2026-06-19,"How to Hide Promoted Posts on LinkedIn Now",how-to-hide-promoted-posts-on-linkedin-now,ads,"hide promoted posts on LinkedIn"
2026-06-20,"Hide Likes This Posts on LinkedIn",hide-likes-this-posts-on-linkedin,reactions,"how to hide likes this posts on LinkedIn"
2026-06-21,"Hide Reshared Posts on LinkedIn Fast",hide-reshared-posts-on-linkedin-fast,shares,"hide reshared posts on LinkedIn"
2026-06-22,"Hide Recommended Posts on LinkedIn Now",hide-recommended-posts-on-linkedin-now,suggested,"hide recommended posts on LinkedIn"
2026-06-23,"LinkedIn Feed for HR Teams for Work",linkedin-feed-for-hr-teams-for-work,persona,"LinkedIn feed for HR teams"
2026-06-24,"LinkTopics vs LinkedIn Premium Today",linktopics-vs-linkedin-premium-today,comparison,"LinkTopics vs LinkedIn Premium"
2026-06-25,"Clean LinkedIn Feed for Focus Today",clean-linkedin-feed-for-focus-today,strategy,"clean LinkedIn feed"
2026-06-26,"Hide Sponsored Posts on LinkedIn Fast",hide-sponsored-posts-on-linkedin-fast,ads,"hide sponsored posts on LinkedIn"
2026-06-27,"Hide Liked Posts on LinkedIn: Setup",hide-liked-posts-on-linkedin-setup,reactions,"hide liked posts on LinkedIn"
2026-06-28,"Hide Reposted Posts on LinkedIn Fast",hide-reposted-posts-on-linkedin-fast,shares,"hide reposted posts on LinkedIn"
2026-06-29,"Why LinkedIn Suggests Posts: Guide",why-linkedin-suggests-posts-guide,suggested,"why LinkedIn suggests posts"
2026-06-30,"LinkedIn Feed for Recruiters at Work",linkedin-feed-for-recruiters-at-work,persona,"LinkedIn feed for recruiters"
2026-07-01,"LinkTopics vs LinkedIn Ad Blockers Now",linktopics-vs-linkedin-ad-blockers-now,comparison,"LinkTopics vs LinkedIn ad blockers"
2026-07-02,"LinkedIn Feed for Productivity: Tips",linkedin-feed-for-productivity-tips,strategy,"LinkedIn feed productivity"
2026-07-03,"Best LinkedIn Ad Blocker Less Noise",best-linkedin-ad-blocker-less-noise,ads,"best LinkedIn ad blocker"
2026-07-04,"Hide Reacted Posts on LinkedIn 2026",hide-reacted-posts-on-linkedin-2026,reactions,"hide reacted posts on LinkedIn"
2026-07-05,"Why LinkedIn Shows Reposts on Chrome",why-linkedin-shows-reposts-on-chrome,shares,"why LinkedIn shows reposts"
2026-07-06,"Why LinkedIn Recommends Posts 2026",why-linkedin-recommends-posts-2026,suggested,"why LinkedIn recommends posts"
2026-07-07,"LinkedIn Feed for Sales Teams Today",linkedin-feed-for-sales-teams-today,persona,"LinkedIn feed for sales teams"
2026-07-08,"Feed Cleaner vs Manual Cleanup Today",feed-cleaner-vs-manual-cleanup-today,comparison,"feed cleaner vs manual cleanup"
2026-07-09,"LinkedIn Focus Mode Guide July 2026",linkedin-focus-mode-guide-july-2026,strategy,"LinkedIn focus mode"
2026-07-10,"Block Promoted Posts on LinkedIn Fast",block-promoted-posts-on-linkedin-fast,ads,"block promoted posts LinkedIn"
2026-07-11,"Why LinkedIn Shows Loves This 2026",why-linkedin-shows-loves-this-2026,reactions,"why LinkedIn shows loves this posts"
2026-07-12,"Why LinkedIn Shows Shared Posts 2026",why-linkedin-shows-shared-posts-2026,shares,"why LinkedIn shows shared posts"
2026-07-13,"Hide LinkedIn Recommended Content Now",hide-linkedin-recommended-content-now,suggested,"hide recommended content on LinkedIn"
2026-07-14,"LinkedIn Feed for Marketers for Work",linkedin-feed-for-marketers-for-work,persona,"LinkedIn feed for marketers"
2026-07-15,"uBlock Origin for LinkedIn: Review",ublock-origin-for-linkedin-review,comparison,"uBlock Origin for LinkedIn"
2026-07-16,"Stop LinkedIn Distractions at Work",stop-linkedin-distractions-at-work,strategy,"stop LinkedIn distractions"
2026-07-17,"How to Remove LinkedIn Ads on Chrome",how-to-remove-linkedin-ads-on-chrome,ads,"remove LinkedIn ads"
2026-07-18,"Hide Celebrates This on LinkedIn Fast",hide-celebrates-this-on-linkedin-fast,reactions,"hide celebrates this on LinkedIn"
2026-07-19,"Hide Shared Posts on LinkedIn Fast",hide-shared-posts-on-linkedin-fast,shares,"hide shared posts on LinkedIn"
2026-07-20,"Hide Suggested Posts on LinkedIn 2026",hide-suggested-posts-on-linkedin-2026,suggested,"hide suggested posts on LinkedIn"
2026-07-21,"LinkedIn Feed for Founders at Work",linkedin-feed-for-founders-at-work,persona,"LinkedIn feed for founders"
2026-07-22,"AdBlock on LinkedIn Feed: Checklist",adblock-on-linkedin-feed-checklist,comparison,"AdBlock for LinkedIn"
2026-07-23,"What a LinkedIn Feed Cleaner Does Now",what-a-linkedin-feed-cleaner-does-now,strategy,"LinkedIn feed cleaner"
2026-07-24,"How to Hide Promoted Posts on LinkedIn Fast",how-to-hide-promoted-posts-on-linkedin-fast,ads,"hide promoted posts on LinkedIn"
2026-07-25,"Hide Insightful Posts on LinkedIn Now",hide-insightful-posts-on-linkedin-now,reactions,"hide insightful posts on LinkedIn"
2026-07-26,"Hide Reshared Posts on LinkedIn 2026",hide-reshared-posts-on-linkedin-2026,shares,"hide reshared posts on LinkedIn"
2026-07-27,"Hide Recommended Posts on LinkedIn Fast",hide-recommended-posts-on-linkedin-fast,suggested,"hide recommended posts on LinkedIn"
2026-07-28,"LinkedIn Feed for Consultants Today",linkedin-feed-for-consultants-today,persona,"LinkedIn feed for consultants"
2026-07-29,"LinkedIn Settings vs Feed Cleaner Now",linkedin-settings-vs-feed-cleaner-now,comparison,"native LinkedIn settings vs feed cleaner"
2026-07-30,"LinkedIn Chrome Extension Guide 2026",linkedin-chrome-extension-guide-2026,strategy,"LinkedIn chrome extension"
2026-07-31,"Hide Sponsored Posts on LinkedIn 2026",hide-sponsored-posts-on-linkedin-2026,ads,"hide sponsored posts on LinkedIn"
2026-08-01,"Hide Supports This on LinkedIn 2026",hide-supports-this-on-linkedin-2026,reactions,"hide supports this on LinkedIn"
2026-08-02,"Hide Reposted Posts on LinkedIn 2026",hide-reposted-posts-on-linkedin-2026,shares,"hide reposted posts on LinkedIn"
2026-08-03,"Why LinkedIn Suggests Posts for Work",why-linkedin-suggests-posts-for-work,suggested,"why LinkedIn suggests posts"
2026-08-04,"LinkedIn Feed for Job Seekers Today",linkedin-feed-for-job-seekers-today,persona,"LinkedIn feed for job seekers"
2026-08-05,"LinkTopics vs LinkedIn Premium Now",linktopics-vs-linkedin-premium-now,comparison,"LinkTopics vs LinkedIn Premium"
2026-08-06,"Clean LinkedIn Feed for Focus 2026",clean-linkedin-feed-for-focus-2026,strategy,"clean LinkedIn feed"
2026-08-07,"Best LinkedIn Ad Blocker Quick Tips",best-linkedin-ad-blocker-quick-tips,ads,"best LinkedIn ad blocker"
2026-08-08,"Hide Likes This Posts on LinkedIn Now",hide-likes-this-posts-on-linkedin-now,reactions,"how to hide likes this posts on LinkedIn"
2026-08-09,"Why LinkedIn Shows Reposts at Work",why-linkedin-shows-reposts-at-work,shares,"why LinkedIn shows reposts"
2026-08-10,"Why LinkedIn Recommends Posts: Guide",why-linkedin-recommends-posts-guide,suggested,"why LinkedIn recommends posts"
2026-08-11,"LinkedIn Feed for HR Teams at Work",linkedin-feed-for-hr-teams-at-work,persona,"LinkedIn feed for HR teams"
2026-08-12,"LinkTopics vs LinkedIn Ad Blockers 2026",linktopics-vs-linkedin-ad-blockers-2026,comparison,"LinkTopics vs LinkedIn ad blockers"
2026-08-13,"LinkedIn Feed for Productivity Today",linkedin-feed-for-productivity-today,strategy,"LinkedIn feed productivity"
2026-08-14,"Block Promoted Posts on LinkedIn 2026",block-promoted-posts-on-linkedin-2026,ads,"block promoted posts LinkedIn"
2026-08-15,"Hide Liked Posts on LinkedIn Today",hide-liked-posts-on-linkedin-today,reactions,"hide liked posts on LinkedIn"
2026-08-16,"Why LinkedIn Shows Shared Posts Today",why-linkedin-shows-shared-posts-today,shares,"why LinkedIn shows shared posts"
2026-08-17,"Hide LinkedIn Recommended Content Fast",hide-linkedin-recommended-content-fast,suggested,"hide recommended content on LinkedIn"
2026-08-18,"LinkedIn Feed for Recruiters: Tips",linkedin-feed-for-recruiters-tips,persona,"LinkedIn feed for recruiters"
2026-08-19,"Feed Cleaner vs Manual Cleanup Now",feed-cleaner-vs-manual-cleanup-now,comparison,"feed cleaner vs manual cleanup"
2026-08-20,"LinkedIn Focus Mode Guide: Explained",linkedin-focus-mode-guide-explained,strategy,"LinkedIn focus mode"
2026-08-21,"How to Remove LinkedIn Ads Quick Fix",how-to-remove-linkedin-ads-quick-fix,ads,"remove LinkedIn ads"
2026-08-22,"Hide Reacted Posts on LinkedIn Today",hide-reacted-posts-on-linkedin-today,reactions,"hide reacted posts on LinkedIn"
2026-08-23,"Hide Shared Posts on LinkedIn 2026",hide-shared-posts-on-linkedin-2026,shares,"hide shared posts on LinkedIn"
2026-08-24,"Hide Suggested Posts on LinkedIn",hide-suggested-posts-on-linkedin,suggested,"hide suggested posts on LinkedIn"
2026-08-25,"LinkedIn Feed for Sales Teams 2026",linkedin-feed-for-sales-teams-2026,persona,"LinkedIn feed for sales teams"
2026-08-26,"uBlock Origin for LinkedIn on Chrome",ublock-origin-for-linkedin-on-chrome,comparison,"uBlock Origin for LinkedIn"
2026-08-27,"Stop LinkedIn Distractions: Guide",stop-linkedin-distractions-guide,strategy,"stop LinkedIn distractions"
2026-08-28,"How to Hide Promoted Posts on LinkedIn 2026",how-to-hide-promoted-posts-on-linkedin-2026,ads,"hide promoted posts on LinkedIn"
2026-08-29,"Why LinkedIn Shows Loves This: Guide",why-linkedin-shows-loves-this-guide,reactions,"why LinkedIn shows loves this posts"
2026-08-30,"Hide Reshared Posts on LinkedIn Today",hide-reshared-posts-on-linkedin-today,shares,"hide reshared posts on LinkedIn"
2026-08-31,"Hide Recommended Posts on LinkedIn 2026",hide-recommended-posts-on-linkedin-2026,suggested,"hide recommended posts on LinkedIn"
2026-09-01,"LinkedIn Feed for Marketers: Guide",linkedin-feed-for-marketers-guide,persona,"LinkedIn feed for marketers"
2026-09-02,"AdBlock on LinkedIn Feed on Chrome",adblock-on-linkedin-feed-on-chrome,comparison,"AdBlock for LinkedIn"
2026-09-03,"What a LinkedIn Feed Cleaner Does 2026",what-a-linkedin-feed-cleaner-does-2026,strategy,"LinkedIn feed cleaner"
2026-09-04,"Hide Sponsored Posts on LinkedIn",hide-sponsored-posts-on-linkedin,ads,"hide sponsored posts on LinkedIn"
2026-09-05,"Hide Celebrates This on LinkedIn 2026",hide-celebrates-this-on-linkedin-2026,reactions,"hide celebrates this on LinkedIn"
2026-09-06,"Hide Reposted Posts on LinkedIn Today",hide-reposted-posts-on-linkedin-today,shares,"hide reposted posts on LinkedIn"
2026-09-07,"Why LinkedIn Suggests Posts Today",why-linkedin-suggests-posts-today,suggested,"why LinkedIn suggests posts"
2026-09-08,"LinkedIn Feed for Founders: Playbook",linkedin-feed-for-founders-playbook,persona,"LinkedIn feed for founders"
2026-09-09,"LinkedIn Settings vs Feed Cleaner 2026",linkedin-settings-vs-feed-cleaner-2026,comparison,"native LinkedIn settings vs feed cleaner"
2026-09-10,"LinkedIn Chrome Extension Guide: Tips",linkedin-chrome-extension-guide-tips,strategy,"LinkedIn chrome extension"
2026-09-11,"Best LinkedIn Ad Blocker Work Guide",best-linkedin-ad-blocker-work-guide,ads,"best LinkedIn ad blocker"
2026-09-12,"Hide Insightful Posts on LinkedIn Fast",hide-insightful-posts-on-linkedin-fast,reactions,"hide insightful posts on LinkedIn"
2026-09-13,"Why LinkedIn Shows Reposts Quick Fix",why-linkedin-shows-reposts-quick-fix,shares,"why LinkedIn shows reposts"
2026-09-14,"Why LinkedIn Recommends Posts Now",why-linkedin-recommends-posts-now,suggested,"why LinkedIn recommends posts"
2026-09-15,"LinkedIn Feed for Consultants 2026",linkedin-feed-for-consultants-2026,persona,"LinkedIn feed for consultants"
2026-09-16,"LinkTopics vs LinkedIn Premium: Guide",linktopics-vs-linkedin-premium-guide,comparison,"LinkTopics vs LinkedIn Premium"
2026-09-17,"Clean LinkedIn Feed for Focus: Guide",clean-linkedin-feed-for-focus-guide,strategy,"clean LinkedIn feed"
2026-09-18,"Block Promoted Posts on LinkedIn",block-promoted-posts-on-linkedin,ads,"block promoted posts LinkedIn"
2026-09-19,"Hide Supports This on LinkedIn Today",hide-supports-this-on-linkedin-today,reactions,"hide supports this on LinkedIn"
2026-09-20,"Why LinkedIn Shows Shared Posts: Guide",why-linkedin-shows-shared-posts-guide,shares,"why LinkedIn shows shared posts"
2026-09-21,"Hide LinkedIn Recommended Content 2026",hide-linkedin-recommended-content-2026,suggested,"hide recommended content on LinkedIn"
2026-09-22,"LinkedIn Feed for Job Seekers 2026",linkedin-feed-for-job-seekers-2026,persona,"LinkedIn feed for job seekers"
2026-09-23,"LinkTopics vs LinkedIn Ad Blockers Today",linktopics-vs-linkedin-ad-blockers-today,comparison,"LinkTopics vs LinkedIn ad blockers"
2026-09-24,"LinkedIn Feed for Productivity Now",linkedin-feed-for-productivity-now,strategy,"LinkedIn feed productivity"
2026-09-25,"How to Remove LinkedIn Ads at Work",how-to-remove-linkedin-ads-at-work,ads,"remove LinkedIn ads"
2026-09-26,"Hide Likes This Posts on LinkedIn Fast",hide-likes-this-posts-on-linkedin-fast,reactions,"how to hide likes this posts on LinkedIn"
2026-09-27,"Hide Shared Posts on LinkedIn: Guide",hide-shared-posts-on-linkedin-guide,shares,"hide shared posts on LinkedIn"
2026-09-28,"Hide Suggested Posts on LinkedIn Today",hide-suggested-posts-on-linkedin-today,suggested,"hide suggested posts on LinkedIn"
2026-09-29,"LinkedIn Feed for HR Teams: Playbook",linkedin-feed-for-hr-teams-playbook,persona,"LinkedIn feed for HR teams"
2026-09-30,"Feed Cleaner vs Manual Cleanup: Guide",feed-cleaner-vs-manual-cleanup-guide,comparison,"feed cleaner vs manual cleanup"
2026-10-01,"LinkedIn Focus Mode Guide: Checklist",linkedin-focus-mode-guide-checklist,strategy,"LinkedIn focus mode"
2026-10-02,"How to Hide Promoted Posts on LinkedIn Today",how-to-hide-promoted-posts-on-linkedin-today,ads,"hide promoted posts on LinkedIn"
2026-10-03,"Hide Liked Posts on LinkedIn: Tips",hide-liked-posts-on-linkedin-tips,reactions,"hide liked posts on LinkedIn"
2026-10-04,"Hide Reshared Posts on LinkedIn: Tips",hide-reshared-posts-on-linkedin-tips,shares,"hide reshared posts on LinkedIn"
2026-10-05,"Hide Recommended Posts on LinkedIn Today",hide-recommended-posts-on-linkedin-today,suggested,"hide recommended posts on LinkedIn"
2026-10-06,"LinkedIn Feed for Recruiters Today",linkedin-feed-for-recruiters-today,persona,"LinkedIn feed for recruiters"
2026-10-07,"uBlock Origin for LinkedIn at Work",ublock-origin-for-linkedin-at-work,comparison,"uBlock Origin for LinkedIn"
2026-10-08,"Stop LinkedIn Distractions: Explained",stop-linkedin-distractions-explained,strategy,"stop LinkedIn distractions"
2026-10-09,"Hide Sponsored Posts on LinkedIn Today",hide-sponsored-posts-on-linkedin-today,ads,"hide sponsored posts on LinkedIn"
2026-10-10,"Hide Reacted Posts on LinkedIn Now",hide-reacted-posts-on-linkedin-now,reactions,"hide reacted posts on LinkedIn"
2026-10-11,"Hide Reposted Posts on LinkedIn: Tips",hide-reposted-posts-on-linkedin-tips,shares,"hide reposted posts on LinkedIn"
2026-10-12,"Why LinkedIn Suggests Posts on Chrome",why-linkedin-suggests-posts-on-chrome,suggested,"why LinkedIn suggests posts"
2026-10-13,"LinkedIn Feed for Sales Teams: Guide",linkedin-feed-for-sales-teams-guide,persona,"LinkedIn feed for sales teams"
2026-10-14,"AdBlock on LinkedIn Feed Compared",adblock-on-linkedin-feed-compared,comparison,"AdBlock for LinkedIn"
2026-10-15,"What a LinkedIn Feed Cleaner Does: Tips",what-a-linkedin-feed-cleaner-does-tips,strategy,"LinkedIn feed cleaner"
2026-10-16,"Best LinkedIn Ad Blocker on Chrome",best-linkedin-ad-blocker-on-chrome,ads,"best LinkedIn ad blocker"
2026-10-17,"Why LinkedIn Shows Loves This Now",why-linkedin-shows-loves-this-now,reactions,"why LinkedIn shows loves this posts"
2026-10-18,"Why LinkedIn Shows Reposts: Explained",why-linkedin-shows-reposts-explained,shares,"why LinkedIn shows reposts"
2026-10-19,"Why LinkedIn Recommends Posts at Work",why-linkedin-recommends-posts-at-work,suggested,"why LinkedIn recommends posts"
2026-10-20,"LinkedIn Feed for Marketers: Tips",linkedin-feed-for-marketers-tips,persona,"LinkedIn feed for marketers"
2026-10-21,"LinkedIn Settings vs Feed Cleaner Today",linkedin-settings-vs-feed-cleaner-today,comparison,"native LinkedIn settings vs feed cleaner"
2026-10-22,"LinkedIn Chrome Extension Guide Today",linkedin-chrome-extension-guide-today,strategy,"LinkedIn chrome extension"
2026-10-23,"Block Promoted Posts on LinkedIn Today",block-promoted-posts-on-linkedin-today,ads,"block promoted posts LinkedIn"
2026-10-24,"Hide Celebrates This on LinkedIn",hide-celebrates-this-on-linkedin,reactions,"hide celebrates this on LinkedIn"
2026-10-25,"Why LinkedIn Shows Shared Posts",why-linkedin-shows-shared-posts,shares,"why LinkedIn shows shared posts"
2026-10-26,"Hide LinkedIn Recommended Content Today",hide-linkedin-recommended-content-today,suggested,"hide recommended content on LinkedIn"
2026-10-27,"LinkedIn Feed for Founders: Guide",linkedin-feed-for-founders-guide,persona,"LinkedIn feed for founders"
2026-10-28,"LinkTopics vs LinkedIn Premium: Review",linktopics-vs-linkedin-premium-review,comparison,"LinkTopics vs LinkedIn Premium"
2026-10-29,"Clean LinkedIn Feed for Focus at Work",clean-linkedin-feed-for-focus-at-work,strategy,"clean LinkedIn feed"
2026-10-30,"How to Remove LinkedIn Ads Work Tips",how-to-remove-linkedin-ads-work-tips,ads,"remove LinkedIn ads"
2026-10-31,"Hide Insightful Posts on LinkedIn 2026",hide-insightful-posts-on-linkedin-2026,reactions,"hide insightful posts on LinkedIn"
2026-11-01,"Hide Shared Posts on LinkedIn: Setup",hide-shared-posts-on-linkedin-setup,shares,"hide shared posts on LinkedIn"
2026-11-02,"Hide Suggested Posts on LinkedIn: Tips",hide-suggested-posts-on-linkedin-tips,suggested,"hide suggested posts on LinkedIn"
2026-11-03,"LinkedIn Feed for Consultants: Guide",linkedin-feed-for-consultants-guide,persona,"LinkedIn feed for consultants"
2026-11-04,"LinkTopics vs LinkedIn Ad Blockers: Guide",linktopics-vs-linkedin-ad-blockers-guide,comparison,"LinkTopics vs LinkedIn ad blockers"
2026-11-05,"LinkedIn Feed for Productivity: Guide",linkedin-feed-for-productivity-guide,strategy,"LinkedIn feed productivity"
2026-11-06,"How to Hide Promoted Posts on LinkedIn: Tips",how-to-hide-promoted-posts-on-linkedin-tips,ads,"hide promoted posts on LinkedIn"
2026-11-07,"Hide Supports This on LinkedIn Now",hide-supports-this-on-linkedin-now,reactions,"hide supports this on LinkedIn"
2026-11-08,"Hide Reshared Posts on LinkedIn: Guide",hide-reshared-posts-on-linkedin-guide,shares,"hide reshared posts on LinkedIn"
2026-11-09,"Hide Recommended Posts on LinkedIn: Tips",hide-recommended-posts-on-linkedin-tips,suggested,"hide recommended posts on LinkedIn"
2026-11-10,"LinkedIn Feed for Job Seekers: Guide",linkedin-feed-for-job-seekers-guide,persona,"LinkedIn feed for job seekers"
2026-11-11,"Feed Cleaner vs Manual Cleanup: Review",feed-cleaner-vs-manual-cleanup-review,comparison,"feed cleaner vs manual cleanup"
2026-11-12,"LinkedIn Focus Mode Guide at Work",linkedin-focus-mode-guide-at-work,strategy,"LinkedIn focus mode"
2026-11-13,"Hide Sponsored Posts on LinkedIn: Tips",hide-sponsored-posts-on-linkedin-tips,ads,"hide sponsored posts on LinkedIn"
2026-11-14,"Hide Likes This Posts on LinkedIn 2026",hide-likes-this-posts-on-linkedin-2026,reactions,"how to hide likes this posts on LinkedIn"
2026-11-15,"Hide Reposted Posts on LinkedIn: Guide",hide-reposted-posts-on-linkedin-guide,shares,"hide reposted posts on LinkedIn"
2026-11-16,"Why LinkedIn Suggests Posts Quick Fix",why-linkedin-suggests-posts-quick-fix,suggested,"why LinkedIn suggests posts"
2026-11-17,"LinkedIn Feed for HR Teams: Guide",linkedin-feed-for-hr-teams-guide,persona,"LinkedIn feed for HR teams"
2026-11-18,"uBlock Origin for LinkedIn: Guide",ublock-origin-for-linkedin-guide,comparison,"uBlock Origin for LinkedIn"
2026-11-19,"Stop LinkedIn Distractions: Checklist",stop-linkedin-distractions-checklist,strategy,"stop LinkedIn distractions"
2026-11-20,"Best LinkedIn Ad Blocker Quick Fix",best-linkedin-ad-blocker-quick-fix,ads,"best LinkedIn ad blocker"
2026-11-21,"Hide Liked Posts on LinkedIn at Work",hide-liked-posts-on-linkedin-at-work,reactions,"hide liked posts on LinkedIn"
2026-11-22,"Why LinkedIn Shows Reposts: Guide",why-linkedin-shows-reposts-guide,shares,"why LinkedIn shows reposts"
2026-11-23,"Why LinkedIn Recommends Posts for Work",why-linkedin-recommends-posts-for-work,suggested,"why LinkedIn recommends posts"
2026-11-24,"LinkedIn Feed for Recruiters 2026",linkedin-feed-for-recruiters-2026,persona,"LinkedIn feed for recruiters"
2026-11-25,"AdBlock on LinkedIn Feed: Quick Guide",adblock-on-linkedin-feed-quick-guide,comparison,"AdBlock for LinkedIn"
2026-11-26,"What a LinkedIn Feed Cleaner Does Today",what-a-linkedin-feed-cleaner-does-today,strategy,"LinkedIn feed cleaner"
2026-11-27,"Block Promoted Posts on LinkedIn: Tips",block-promoted-posts-on-linkedin-tips,ads,"block promoted posts LinkedIn"
2026-11-28,"Hide Reacted Posts on LinkedIn: Tips",hide-reacted-posts-on-linkedin-tips,reactions,"hide reacted posts on LinkedIn"
